[
  { "sourceName": "国家农业科学数据中心·作物栽培与农事规程", "publisher": "中国农业科学院", "sourceUrl": "https://www.agridata.cn/", "version": "2026.1", "license": "政府公开数据", "acquiredDate": "2026-10-09", "relatedTable": "crop-schedule", "status": "registered", "dataSourceType": "cache" },
  { "sourceName": "FAOSTAT·作物生产与生长周期统计", "publisher": "Food and Agriculture Organization of the United Nations (FAO)", "sourceUrl": "https://www.fao.org/faostat/en/#data/QCL", "version": "2026-release", "license": "CC BY 4.0", "acquiredDate": "2026-10-09", "relatedTable": "crop-schedule", "status": "registered", "dataSourceType": "cache" },
  { "sourceName": "中国气象数据网·农业气象指标", "publisher": "中国气象局", "sourceUrl": "https://data.cma.cn/", "version": "2026.1", "license": "政府公开数据", "acquiredDate": "2026-10-09", "relatedTable": "operation-threshold", "status": "registered", "dataSourceType": "cache" },
  { "sourceName": "Open-Meteo·历史与预报气象", "publisher": "Open-Meteo", "sourceUrl": "https://open-meteo.com/", "version": "v1", "license": "CC BY 4.0", "acquiredDate": "2026-10-09", "relatedTable": "operation-threshold", "status": "registered", "dataSourceType": "cache" },
  { "sourceName": "CGIAR·作物物候与生长阶段", "publisher": "CGIAR System Organization", "sourceUrl": "https://www.cgiar.org/", "version": "2026", "license": "CC BY 4.0", "acquiredDate": "2026-10-09", "relatedTable": "phenology-stage", "status": "registered", "dataSourceType": "cache" },
  { "sourceName": "全国农业技术推广服务中心·作物生育期资料", "publisher": "全国农业技术推广服务中心（农业农村部）", "sourceUrl": "http://www.natesc.org.cn/", "version": "2026", "license": "政府公开数据", "acquiredDate": "2026-10-09", "relatedTable": "phenology-stage", "status": "registered", "dataSourceType": "cache" },
  { "sourceName": "中国天气网·二十四节气农事", "publisher": "中国气象局公共气象服务中心", "sourceUrl": "https://www.weather.com.cn/", "version": "2026", "license": "政府公开数据", "acquiredDate": "2026-10-09", "relatedTable": "solar-term-farming", "status": "registered", "dataSourceType": "cache" },
  { "sourceName": "中国农业信息网·农产品市场与节庆消费", "publisher": "农业农村部", "sourceUrl": "http://www.agri.cn/", "version": "2026", "license": "政府公开数据", "acquiredDate": "2026-10-09", "relatedTable": "festival-rule", "status": "registered", "dataSourceType": "cache" },
  { "sourceName": "某商业农业数据接口（未授权转载）", "publisher": "未知第三方", "sourceUrl": "https://example.com/agri-proprietary", "version": "unknown", "license": "许可不明", "acquiredDate": "2026-10-09", "relatedTable": "crop-schedule", "status": "rejected", "rejectionReason": "许可不明确，无法确认允许再利用，按合规红线拒绝引入", "dataSourceType": "cache" },

  { "sourceName": "中国气象局·实时气象观测接口", "publisher": "中国气象局", "sourceUrl": "https://data.cma.cn/", "version": "2026.1", "license": "政府公开数据", "acquiredDate": "2026-10-09", "relatedTable": "operation-threshold", "status": "registered", "dataSourceType": "realtime" },
  { "sourceName": "广东省气象局·实时气象数据", "publisher": "广东省气象局", "sourceUrl": "http://www.gdweather.com/", "version": "2026", "license": "政府公开数据", "acquiredDate": "2026-10-09", "relatedTable": "operation-threshold", "status": "registered", "dataSourceType": "realtime" },
  { "sourceName": "盘古气象大模型·天气预报预测服务", "publisher": "华为云", "sourceUrl": "https://www.huaweicloud.com/product/pangu.html", "version": "2026", "license": "允许调用的商业服务许可", "acquiredDate": "2026-10-09", "relatedTable": "operation-threshold", "status": "registered", "dataSourceType": "predicted" },

  { "sourceName": "国家农业科学数据中心·油料作物栽培", "publisher": "中国农业科学院", "sourceUrl": "https://www.agridata.cn/", "version": "2026.1", "license": "政府公开数据", "acquiredDate": "2026-10-09", "relatedTable": "crop-schedule", "status": "registered", "dataSourceType": "cache" },
  { "sourceName": "国家农业科学数据中心·饲料作物与牧草", "publisher": "中国农业科学院", "sourceUrl": "https://www.agridata.cn/", "version": "2026.1", "license": "政府公开数据", "acquiredDate": "2026-10-09", "relatedTable": "crop-schedule", "status": "registered", "dataSourceType": "cache" },
  { "sourceName": "中国中药材种植信息网·药用作物栽培", "publisher": "中国中医科学院", "sourceUrl": "http://www.zyycw.com/", "version": "2026", "license": "政府公开数据", "acquiredDate": "2026-10-09", "relatedTable": "crop-schedule", "status": "registered", "dataSourceType": "cache" },
  { "sourceName": "中国茶叶流通协会·茶树栽培技术", "publisher": "中国茶叶流通协会", "sourceUrl": "http://www.ctma.com.cn/", "version": "2026", "license": "政府公开数据", "acquiredDate": "2026-10-09", "relatedTable": "crop-schedule", "status": "registered", "dataSourceType": "cache" }
]